{
  "applies_to": {
    "pin_type": "POWER_IN"
  },
  "basis": "ENGINEERING_DEFAULT",
  "evidence": [],
  "id": "rule:default-ic-decoupling",
  "layout": [
    {
      "kind": "PLACE_NEAR",
      "max_distance": {
        "basis": "ENGINEERING_DEFAULT",
        "conditions": {},
        "note": "G1 engineering design choice; verify during board layout.",
        "unit": "mm",
        "value": 3
      },
      "subject": "decoupling_capacitor",
      "target": "power_pin"
    }
  ],
  "note": "Bind each IC power pin to a ceramic capacitor across its power and ground nets; prioritize the shortest return loop.",
  "provenance": {
    "created_by": "agent:/root/implement_pcbknowledge_brief/build_g1_blocks",
    "verified_by": [
      "agent:/root"
    ]
  },
  "schema": "pcbknowledge.rule.v2",
  "verification": "AGENT_VERIFIED"
}
